{
  "$comment": "Copied from github.com/modelcontextprotocol/mcpb schemas/mcpb-manifest-v0.3.schema.json (fetched 2026-10-12) so scripts/build_mcpb.py can validate offline. Refresh when bumping manifest_version.",
  "$schema": "http://json-schema.org/draft-07/schema#",
  "type": "object",
  "properties": {
    "$schema": { "type": "string" },
    "dxt_version": { "type": "string", "const": "0.3" },
    "manifest_version": { "type": "string", "const": "0.3" },
    "name": { "type": "string" },
    "display_name": { "type": "string" },
    "version": { "type": "string" },
    "description": { "type": "string" },
    "long_description": { "type": "string" },
    "author": {
      "type": "object",
      "properties": {
        "name": { "type": "string" },
        "email": { "type": "string", "format": "email" },
        "url": { "type": "string", "format": "uri" }
      },
      "required": ["name"],
      "additionalProperties": false
    },
    "repository": {
      "type": "object",
      "properties": { "type": { "type": "string" }, "url": { "type": "string", "format": "uri" } },
      "required": ["type", "url"],
      "additionalProperties": false
    },
    "homepage": { "type": "string", "format": "uri" },
    "documentation": { "type": "string", "format": "uri" },
    "support": { "type": "string", "format": "uri" },
    "icon": { "type": "string" },
    "icons": {
      "type": "array",
      "items": {
        "type": "object",
        "properties": {
          "src": { "type": "string" },
          "size": { "type": "string", "pattern": "^\\d+x\\d+$" },
          "theme": { "type": "string", "minLength": 1 }
        },
        "required": ["src", "size"],
        "additionalProperties": false
      }
    },
    "screenshots": { "type": "array", "items": { "type": "string" } },
    "localization": {
      "type": "object",
      "properties": {
        "resources": { "type": "string", "pattern": "\\$\\{locale\\}" },
        "default_locale": { "type": "string", "pattern": "^[A-Za-z0-9]{2,8}(?:-[A-Za-z0-9]{1,8})*$" }
      },
      "required": ["resources", "default_locale"],
      "additionalProperties": false
    },
    "server": {
      "type": "object",
      "properties": {
        "type": { "type": "string", "enum": ["python", "node", "binary"] },
        "entry_point": { "type": "string" },
        "mcp_config": {
          "type": "object",
          "properties": {
            "command": { "type": "string" },
            "args": { "type": "array", "items": { "type": "string" } },
            "env": { "type": "object", "additionalProperties": { "type": "string" } },
            "platform_overrides": {
              "type": "object",
              "additionalProperties": {
                "type": "object",
                "properties": {
                  "command": { "type": "string" },
                  "args": { "type": "array", "items": { "type": "string" } },
                  "env": { "type": "object", "additionalProperties": { "type": "string" } }
                },
                "additionalProperties": false
              }
            }
          },
          "required": ["command"],
          "additionalProperties": false
        }
      },
      "required": ["type", "entry_point", "mcp_config"],
      "additionalProperties": false
    },
    "tools": {
      "type": "array",
      "items": {
        "type": "object",
        "properties": { "name": { "type": "string" }, "description": { "type": "string" } },
        "required": ["name"],
        "additionalProperties": false
      }
    },
    "tools_generated": { "type": "boolean" },
    "prompts": {
      "type": "array",
      "items": {
        "type": "object",
        "properties": {
          "name": { "type": "string" },
          "description": { "type": "string" },
          "arguments": { "type": "array", "items": { "type": "string" } },
          "text": { "type": "string" }
        },
        "required": ["name", "text"],
        "additionalProperties": false
      }
    },
    "prompts_generated": { "type": "boolean" },
    "keywords": { "type": "array", "items": { "type": "string" } },
    "license": { "type": "string" },
    "privacy_policies": { "type": "array", "items": { "type": "string", "format": "uri" } },
    "compatibility": {
      "type": "object",
      "properties": {
        "claude_desktop": { "type": "string" },
        "platforms": { "type": "array", "items": { "type": "string", "enum": ["darwin", "win32", "linux"] } },
        "runtimes": {
          "type": "object",
          "properties": { "python": { "type": "string" }, "node": { "type": "string" } },
          "additionalProperties": false
        }
      },
      "additionalProperties": false
    },
    "user_config": {
      "type": "object",
      "additionalProperties": {
        "type": "object",
        "properties": {
          "type": { "type": "string", "enum": ["string", "number", "boolean", "directory", "file"] },
          "title": { "type": "string" },
          "description": { "type": "string" },
          "required": { "type": "boolean" },
          "default": {
            "anyOf": [
              { "type": "string" },
              { "type": "number" },
              { "type": "boolean" },
              { "type": "array", "items": { "type": "string" } }
            ]
          },
          "multiple": { "type": "boolean" },
          "sensitive": { "type": "boolean" },
          "min": { "type": "number" },
          "max": { "type": "number" }
        },
        "required": ["type", "title", "description"],
        "additionalProperties": false
      }
    },
    "_meta": {
      "type": "object",
      "additionalProperties": { "type": "object", "additionalProperties": {} }
    }
  },
  "required": ["name", "version", "description", "author", "server"],
  "additionalProperties": false
}
